Texto,Respuesta
Esto es una forma de prueba, Prueba
Yo me quité la cuenta hace meses, Visionario
Pues es malísima, Nada nuevo bajo el Sol
Mi consejo es que cojas la furgoneta de la empresa Primer aparcamiento en batería que veas según salga un coche de los aparcados estréllate contra él, Plan sin fisuras
Pedazo empresa cuatro duros y encima eso, La auténtica salud
Eso es como el dinero debajo del colchón, La auténtica salud
Llego reventado a casa, No sé Rick
Tiene que ser una que tenga opción de loguearte de Youtube de otra forma no tienes permiso para verlo, Qué tramas moreno